3507	Top-seeded Americans Andy Roddick and Andre Agassi survived minor scares to reach the last eight of the SAP Open.Agassi also employed several lobs and charged to the net to unsettle the 31-year-old Dane, ranked 88th in the world.Agassi endured early problems against left-handed Dane Kenneth Carlsen before sealing a 7-5 6-1 victory."I'm not playing great," he said.And world number three Roddick dropped a set to Korean player Hyung-Taik Lee, before pulling out a 6-3 3-6 6-2 win in San Jose, California."As the match went on, I got real patient and waited for my opportunities and felt pretty good," said Agassi.	sport
1236	The buzz about the band soon spread around the music industry and 40 record labels turned up to one gig in Glasgow - which the band thought was "totally ridiculous".Scottish rock band Franz Ferdinand, who shot to prominence in 2004, have won two Brit Awards.At the turn of the year, Kapranos told BBC News Online the band were fed up with serious bands in "that post-rock thing that seemed to be doing its damndest to avoid any bloody tune".Nevertheless Franz Ferdinand were the only UK band to win an MTV Video Music Award this year, taking the breakthrough video crown for Take Me Out.Franz Ferdinand had a question they asked themselves every time they wrote a song, Kapranos said.In September it was named album of the year winning the prestigious Mercury Music Prize.With a cool, spiky, fun sound previously associated with bands like Talking Heads, they hit upon a style that had been out of fashion for a while and so was ripe for another airing.The four-piece met two years ago when drummer Paul Thomson was working at the Glasgow art school where bassist Bob Hardy was studying.With their self-titled debut, Franz Ferdinand have achieved what most rock bands crave - high credibility and critical acclaim while also selling stacks of CDs.Singer Alex Kapranos was studying English at university but had friends at art school, and the line-up was completed when guitarist Nick McCarthy moved from Munich, Germany, to the city.They have been nominated for three Grammy awards in the US as well as the US music industry's Shortlist award, but lost the Shortlist prize to US band TV on the Radio.	entertainment
2149	At a news conference following talks with Mr Blair, Mr Abbas said the British prime minister was "in a unique position to help us progress in our peaceful pursuit".Mr Blair also made a surprise trip to Iraq this week.Mr Blair acknowledged some people believed he was too close to the Israelis, but said the Israelis were entitled to expect Palestinians to give up terrorism.Mr Blair held talks with his Israeli counterpart, Ariel Sharon, and the Palestinian leader, Mahmoud Abbas.In an interview with the BBC's political editor Andrew Marr, Mr Blair said getting progress between Israelis and Palestinians would be "tough, but at least we have got the first step".Before visiting Israel, Mr Blair made a surprise visit to Iraq, where he met leaders in Baghdad during his first trip to the city.Earlier, Mr Sharon again said he had not seen "the slightest step" the Palestinians were working to end terror attacks - though he acknowledged Palestinian leaders were in the middle of an election campaign that could be hampering their efforts.	politics
4156	Sloncek said that currently only a Windows version of the software was in development.Mr Pouwelse said that future versions of file-sharing systems are likely to incorporate some kind of distributed reputation system that lets moderators prove who they are to the network and rate which files are worth downloading.In an interview with Novastream web radio, Sloncek said Exeem would combine ideas from the BitTorrent and Kazaa file-sharing systems.Like BitTorrent, Exeem will have trackers that help point people toward the file they want.But, he said, it would struggle to be as popular as BitTorrent and Suprnova because early versions were not taking enough care to make sure good copies of files were being shared.When big files were being shared moderation systems were key, said Mr Pouwelse."The rating system in Exeem seems flawed because it is easy to insert both fake files and fake ratings," he said.This, said Sloncek, should make the system less vulnerable to legal action aimed at stopping people swapping pirated movies and music.One of the sites shut down by the legal campaign was suprnova.org which helped boost the popularity of the BitTorrent system by checking that trackers led to the movies or TV programmes they claimed to."The moderators are the difference between having a system that works and one that's full of crap like Kazaa," he said.Users of the Exeem system will be able to rate files being swapped to help stop the spread of fake files, Sloncek told Novastream."Exeem cannot prevent pollution," he said.He said that costs of writing the software will be paid for by adverts appearing in the finished version of the program.One site behind the success of the BitTorrent file-swapping system is producing its own software that avoids the pitfalls of the earlier program.	tech
4109	It showed that people keep their fixed line phone because call charges are lower, but most of those questioned said the future was definitely mobile.In the UK 69% of those questioned said they turned to their fixed phone because it was still cheaper to use than a mobile.The move to mobile was most pronounced in South Korea where 65% of those questioned said they already make most of their calls from a mobile.In the US and Germany many of those interviewed said they used the fixed phone because it was more reliable than a mobile handset and let them get access to the net at relatively high speeds.Home phones were used for longer calls but conversations on mobiles tended to be shorter, between mobiles and to friends.In all the countries where interviews were carried out, older people were more likely to use a fixed line phone more than a mobile.The Nokia-sponsored research showed that mobiles and fixed phones were used for different purposes.Research by handset maker Nokia shows that more and more people are using their mobile phone for every call they make or take.	tech
1088	Ocean's Twelve, the crime caper sequel starring George Clooney, Brad Pitt and Julia Roberts, has gone straight to number one in the US box office chart.The sequel narrowly beat its 2001 predecessor, Ocean's Eleven which took $38.1m (£19.8m) on its opening weekend and $184m (£95.8m) in total.A remake of the 1960s film, starring Frank Sinatra and the Rat Pack, Ocean's Eleven was directed by Oscar-winning director Steven Soderbergh.Ocean's Twelve box office triumph marks the fourth-biggest opening for a December release in the US, after the three films in the Lord of the Rings trilogy.Soderbergh returns to direct the hit sequel which reunites Clooney, Pitt and Roberts with Matt Damon, Andy Garcia and Elliott Gould.A milder review in the New York Times dubbed the sequel "unabashedly trivial".	entertainment
479	In the fourth quarter alone Ford reported net income of $104m, compared with a loss of $793m a year ago.Ford, the US car company, reported higher fourth quarter and full-year profits on Thursday boosted by a buoyant period for its car loans unit.Though car and truck loan profits saved the day, Ford's auto unit made a pre-tax loss of $470m in the fourth quarter (compared to a profit of £13m in the year-ago period) and its US sales dipped 3.8%.Fourth quarter turnover was $44.7bn, compared to $45.9bn a year ago.Total company vehicle unit sales in 2004 were 6,798,000, an increase of 62,000 units from 2003.Recent new models introduced by Ford include the Ford Five Hundred and Mercury Montego sedans, the Ford Freestyle crossover, the Ford Mustang, the Land Rover LR3/Discovery, and Volvo S40 and V50 in North America and Europe.In addition, the company said 2004 net income was affected by a fourth-quarter pre-tax charge taken to reduce the value of a receivable owed to Ford by Visteon, a former subsidiary.But Ford declined to provide guidance for first quarter 2005.	business
2212	Mr Howard appointed Mr Crosby as his elections chief last October.Mr Crosby's statement said: "The Conservative Party has been making an impact on the issues of lower tax and controlled immigration over the past week."Mr Howard later added there was not "one iota" of truth in the report.But Mr Crosby said in a statement: "I have never had any such conversation... and I do not hold that view."	politics
1059	Sky has signed a major new deal to broadcast this year's Academy Awards, taking over from three years of live Oscar coverage on the BBC.Sky said it was "honoured to have won exclusive broadcasting rights" and promised to cover the event "in a way no other broadcaster could"."Sky is the natural place to see the biggest and most prestigious film event of the year, and will cover the event in a way that no other broadcaster could.""We are honoured to have won the live and exclusive broadcasting rights for The Academy Awards," said Sky Networks' Sophie Turner Laing.Sky first scooped Oscar rights from the BBC in 1999, but the BBC won them back in 2001 when Sky was forced to pull out of a bidding war due to financial constraints.	entertainment
167	Solidere, in which Mr Hariri was a major shareholder, was the major drag on the index.Shares in Solidere, the Lebanese company founded by assassinated former prime minister Rafik Hariri, fell 15% in renewed trading in Beirut.Critics had accused Mr Hariri of using Lebanon's post-war reconstruction drive for his personal financial gain.Traders said there was some panic selling during Friday's session, the first since a three-day market closure to mourn the death of Mr Hariri.The company owns much of the property in central Beirut, which it restored and redeveloped following the end of Lebanon's bitter 15-year civil war.	business
2103	About 50,000 children live with foster families in the UK and carers have said they need more money to make ends meet."And with a shortage of over 8,000 foster carers in England, it's not a sustainable situation to expect carers to fund foster care from their own pockets.""We need to make sure that arrangements for paying foster carers are as fair and transparent as possible.Foster carers are to be guaranteed a minimum allowance to help cover their costs, the government has announced."But ADSS fully supports proper remuneration for valued foster carers and looks forward to working with ministers, local government and the fostering organisations themselves in order to make sure a sensible and practicable policy emerges."Ms Hodge said: "Foster carers must not be out of pocket when meeting the costs of caring for a looked after child - a crucial role in society."Our proposal for a national minimum rate shows we are serious about creating a better deal for foster carers and about encouraging more people to come forward and consider fostering as a worthwhile and rewarding opportunity."	politics
266	But it argues that more rigorous tax policing has benefited all Russian firms, even targets of the tax police.The calculations demonstrated what many Russian analysts already knew: that increasing the tax rate increases the amount that managers steal, since undeclared income becomes relatively more valuable.The net result, the authors say, is that the extra amount companies pay in tax is more than compensated for by greater efficiency and financial soundness.Since then, the Russian stock market has more than trebled in value, a rise the authors attribute at least in part to the newly tough approach.The report highlights the case of Sibneft, a Russian oil company that came close to merging with Yukos last year."An increase in tax enforcement can increase the amount [of dividends and other income] outside shareholders will receive, even accounting for increased levels of taxation," the authors say.According to the authors, although a variety of changes were sweeping through Russian industry at the time, the increase in tax enforcement is the only likely explanation for the change of fortunes at Sibneft and many of its peers.Genuine, disinterested tax collection might well work wonders in Russia; the problem with recent examples has been the erratic and unpredictable way laws are enforced.And the authors' definition of tax enforcement seems unrealistically Western.The paper's reasoning is complex, and is based on a sophisticated model of the relationship between tax regimes and corporate governance - in particular, the propensity of management to steal from the company.On the other hand, increasing the rigour with which taxes are collected encourages companies to become more transparent, forcing them to be able to demonstrate their financial position far more accurately.For all its faults, corporate Russia has become far more orderly and law-abiding since 2000.	business
3239	David Beckham expressed his relief at Real Madrid's passage to the Champions League knockout phase.Beckham said: "It's expected of Madrid to get through, but it's a relief for the club and players to have won.Real's finish as runners-up in their Champions League group means they cannot face his old club Manchester United in the next round.	sport
193	Stephen Schechter, a UK investment banker who has held talks with Borussia Dortmund over a possible bond sale, said the club needs a capital injection of 35m euros.Borussia Dortmund has posted record losses and missed rent payments on its Westfallen stadium.German football club and former European champion Borussia Dortmund has warned it will go bankrupt if rescue talks with creditors fail.Shares in Borussia Dortmund, Germany's only stock-market listed football club, dropped by almost 23% to 2.05 euros during early afternoon trading.Borussia Dortmund posted a record loss of 68m euros ($89m; £47m) in the 12 months through June.The club has also faced calls to appoint executives from outside the club.	business
1005	Mary Poppins was originally created by author Pamela Travers, who is said to have cried when she saw Disney's 1964 film starring Julie Andrews.The stage adaptation of children's film Mary Poppins has had its opening night in London's West End.Sir Cameron Mackintosh's lavish production, which has cost £9m to bring to the stage, was given a 10-minute standing ovation.Theatre impresario Sir Cameron Mackintosh has said he hopes the musical is a blend of the sweet-natured film and the original book.	entertainment
2392	Mr Brown has signed a debt relief deal with Tanzania which could cost the UK £1 billion.On top of the relief deal with Tanzania Mr Brown said the UK would make similar offers to 70 poorer nations around the world.The days of Britain having to apologise for its colonial past are over, Gordon Brown has said.The UK has already cancelled its bilateral debts - money the UK alone is owed - with the world's poorest nations including Tanzania.Mr Brown said that missionairies had come to Africa because of their sense of duty.Mr Brown, on a week-long tour of Africa, spent two days in Tanzania before heading on Friday evening to Mozambique, a country where more than half of the 17-million population lives below the poverty line."We make this offer unilaterally but we are now asking other countries to join us," the chancellor said.	politics
1303	The UK Film Council said the drop was partly due to 2003 being an especially good year for British film production, when Bridget Jones: The Edge of Reason, Wimbledon and Thunderbirds were all filmed in the UK.It was "too early" to predict whether the downward trend in UK production would continue throughout 2005, the UK Film Council said.Last year the government closed tax loopholes that many film investors had taken advantage of to fund films in the UK.Twenty-seven British films were made in the UK last year following a drop in funding, compared with 45 in 2003, according to the trade weekly.The number of British films produced in the UK fell 40% in 2004, with movies starring Johnny Depp and Jude Law among those affected, Screen Daily has said.It is also due to announce a replacement for UK film tax relief scheme Section 48 in July.The strength of the pound against the dollar is expected to have resulted in a fall in the number of US films shot in the UK during 2004, Screen International added."The reduction in indigenous film production in 2004 was due to a variety of factors, including the continuing long-term trend towards co-production of films in more than one country and changes to financing arrangements."	entertainment
56	BMW has forecast sales growth of at least 10% in Asia this year after registering record sales there in 2004.The luxury carmaker saw strong sales of its three marques - BMW, Mini and Rolls-Royce - in Asia last year after the launch of three new models.China remains the main area of concern for BMW after sales there fell 16% last year.BMW sold nearly 95,000 cars in Asia last year, up 2.6% on 2003.The German carmaker is aiming to boost annual sales in Asia to 150,000 by 2008.BMW sold more than 100 of the iconic models compared with just ten the previous year.	business
2085	Essential Guide to British Quangos 2005 author Dan Lewis said at least 111 of the appointed bodies had been set up since Labour won power in 1997.They were the British Potato Council, the Milk Development Council, the Energy Savings Trust, Agricultural Wages Committees, the Wine Standards Board, the Westminster Foundation for Democracy, the Football Licensing Authority, Investors in People UK and the Economic and Social Research Council.Mr Lewis branded the existence of the 60-employee Potato Council, set up in 1997 to research and promote overseas potato markets, "surprising".Lib Dem spokesman Ed Davey meanwhile said instead of the "bonfire of quangos" New Labour had promised, there had been an "explosion" of them.He urged a limit on the number of quangos that could be set up by any individual government department.Conservative deregulation spokesman John Redwood said: "The research endorses our policy of destroying unwanted and unnecessary quangos, and slimming down the rest.Mr Lewis wants a public inquiry into regional development agencies which cost £1.8bn a year - cash he says which "appears to be almost entirely wasted".The UK has 529 quangos financed with billions of pounds of taxpayers' cash - many of which are useless or duplicate each other's efforts, a report claims."A Conservative government will axe 162 quangos, as part of its drive for more efficient and more accountable government."	politics
292	Job creation was one of last year's main concerns for the US economy.Job creation was one of last year's main concerns for the US economy, and proved to be a main topic of debate in the US presidential election.The US created fewer jobs than expected in December, but analysts said that the dip in hiring was not enough to derail the world's biggest economy."Manufacturing is a cyclical area of the economy and if it's showing job growth, it's a good indication that the economy is on a solid growth track."While worries still remain, the conditions are set for steady growth in 2005, analysts said.The Fed lifted borrowing costs five times last year to 2.25%, citing evidence the US economic recovery was becoming more robust.The unemployment rate stayed at 5.4% in December, and about 200,000 jobs will need to be created each month if that figure is to drop.	business
2317	The Tories have promised a reduction on bills for pensioners, who they say have been hardest hit by year-on-year increases in council tax.Labour says it wants to retain the property-based tax but reform it to make it fairer and says there is scope for councils to become more efficient.They say the council tax is the most unpopular and most unfair tax in Britain, because it puts a "ceiling" on what the richest pay.It would not be means tested, say the Tories, because that would create more bureaucracy and could discourage people from saving for their retirement.They say they are already helping pensioners with council tax bills, with a £100 lump sum for the over-70s and last year the government capped some local councils' budgets to keep demands down.The rate would be set locally, but administered by the Inland Revenue which they say would save at least £300m.Instead households where council tax payers are over 65 would get a rebate covering half their bill, up to a maximum of £500.The party says it would aim for a £5,000 tax-free personal allowance, or a £7,000 allowance for the over-65s.The Liberal Democrats want to do away with the council tax altogether and switch to a local income tax of the kind seen in the USA, Norway and Switzerland.	politics
3436	Williams was also far from content.Davenport defeated China's Jie Zheng 6-2 7-5, while French Open champion Myskina sailed through after her opponent Marion Bartoli retired hurt."I don't know what I was doing there," she said."I feel I have an advantage (over Serena) because I have already played two matches on these courts," she said.Daniela Hantuchova moved into the quarter-finals of the Dubai Open, after beating Elene Likhotseva of Russia 7-5 6-4, and now faces Serena Williams."It was really windy and I hadn't played in the wind.But Hantuchova is in upbeat mood ahead of her clash with the younger Williams sister, who was handed a first-round bye.	sport
3005	Ethiopia's Tirunesh Dibaba set a new world record in winning the women's 5,000m at the Boston Indoor Games.The plan was to go with 500m to go no matter what, but when Bekele made the mistake that was it.Dibaba won in 14 minutes 32.93 seconds to erase the previous world indoor mark of 14:39.29 set by another Ethiopian, Berhane Adera, in Stuttgart last year.Ireland's Alistair Cragg won in 7:39.89 as Bekele battled to second in 7:41.42.	sport
1068	French actress Audrey Tautou, star of hit film Amelie, will play the female lead in the film adaptation of The Da Vinci Code, it has been reported.The movie version of Dan Brown's best-selling novel is being directed by Ron Howard and also stars Tom Hanks.Jeunet was also responsible for directing Tautou in Amelie in 2001, which launched the actress into the mainstream.Oscar-winning director Ron Howard chose Tautou for the part, preferring a French actress to a big name Hollywood star.She also starred as the lead role in critically-acclaimed film Dirty Pretty Things in 2002.	entertainment
2382	If they plan to stay six months or more and are from a country with lots of TB, they would have to have a chest x-ray and further tests if appropriate.People coming to Britain for less than six months would not be medically tested unless they intended to work in health care, childcare or teaching.People would have to prove they have an acceptable standard of health and are unlikely to be a danger to public health in the UK, or impose significant costs or demands on the NHS.Home Office Minister Des Browne says the Government already routinely checks people for TB if they come into the UK for six months or more from high-risk countries.The Tories say people fleeing persecution will not be denied sanctuary in Britain because of poor health.Under 16s would not face tests for hepatitis and HIV.Children and pregnant women wanting to live in Britain permanently would not have to have a chest X-ray for TB.Here's a guide to the plan:  People coming to live and work in Britain from outside the EU.A positive test for TB would automatically mean visa applications being turned down.This says health screening for TB will be targeted on applicants from high-risk areas before they are given entry clearance.Those who are diagnosed with the disease would then need to seek treatment at home before being allowed to enter the UK.They claim government figures show that TB in England has increased by 25% over the last 10 years and that nearly two-thirds of people with the disease were born overseas.	politics
1098	It will be Hanks' third collaboration with Howard.Brown's book has become a publishing phenomenon, consistently topping book charts in the UK and US.Hanks will play Robert Langdon, who is trying to solve the murder of a member of an ancient society that has protected dark secrets for centuries.Actor Tom Hanks and director Ron Howard are reuniting for The Da Vinci Code, an adaptation of the international best-selling novel by Dan Brown.It is a classic whodunit, which centres on a global conspiracy surrounding the Holy Grail mythology and places heavy emphasis on symbols and cryptography.	entertainment
