3040	Paula Radcliffe faces arguably the biggest test of her career in the New York City Marathon on Sunday.Richards also points out conditions in New York will be more conducive to a strong physical display from Radcliffe.And Richards and Yelling agree she could turn the trauma to her advantage, starting in New York.Radcliffe has never raced there before and will enter the unknown just 77 days after the Athens marathon.Radcliffe described her decision to enter the New York marathon as "impulsive" but she is certain to have a tick-list of personal goals."Paula has got all those great runs in her history as well as the two upsets in Athens."It's suggested after a major marathon you take a full month off and start building up again," said Yelling, herself a marathon runner.Radcliffe's best friend and fellow distance runner Liz Yelling revealed the 30-year-old is already aware she will be exposing herself to more public scrutiny in New York.For much of the watching media and public there can only be two possible outcomes in New York - win or lose."She just thought, 'well, they can't think any worse of me now,'" Yelling told BBC Sport."You can't change history," warned Richards.Back under the spotlight of public scrutiny she will attempt to erase the double disappointment of the Athens Olympics, where she failed to finish the marathon and then the 10,000m.BBC Sport examines the challenges facing Radcliffe ahead of the big race."There is an old adage, 'get straight back on the horse that threw you,'" Richards told BBC Sport.And Yelling says: "I think this will probably make Paula."Her aims could be as simple as completing a race and making sure she is still enjoying running but Richards says she must avoid more emotional targets, such as redemption.Radcliffe concedes she will probably learn a lot from her bad experiences in Athens in time.	sport
3198	But Edu was highly critical of the ferocity of some of United's challenges during the game, particularly on Jose Antonio Reyes.However, Edu tried to play down the incidents, adding: "There was nothing that I haven't seen in Brazilian derbies.The Brazilian confirmed tempers had flared but could shed no light on reports that food was thrown at United boss Sir Alex Ferguson."Reyes was being kicked all over the park - they were beating up the boy and Gary Neville was tackling in such a way that he should have been sent off."I like to play in games like this with this intense rivalry."	sport
1144	Last week's number one, Elvis's It's Now or Never, slipped 13 places to number 14, but all five of his re-released songs are in the Top 40.Rapper Eminem has denied Elvis his fourth number one of the year, after his song, Like Toy Soldiers, stormed to the top of the singles charts.In the album charts, Athlete's latest offering Tourist claimed the top spot, toppling the Chemical Brother's Push The Button Down, which fell to number six.One World Project Tsunami fundraiser, Grief Never Grows Old, slipped four places to number eight.	entertainment
4146	The number of Europeans with broadband has exploded over the past 12 months, with the web eating into TV viewing habits, research suggests.It found that a quarter of web users said they spent less time watching TV in favour of the net  The report by Nielsen/NetRatings found that the number of people with fast internet access had risen by 60% over the past year.The threat to TV was greatest in countries where broadband was on the up, in particular the UK, France and Spain, said the report.In homes with broadband, 40% said they were spending less time watching TV.The total number of Europeans online rose by 12% to 100 million over the past year, the report showed, with the biggest rise in France, Italy, Britain and Germany.A study by analysts Jupiter Research suggested that broadband was challenging television viewing habits.Just over 54 million people are hooked up to the net via broadband, up from 34 million a year ago, according to market analysts Nielsen/NetRatings.	tech
4105	A spokesman for the International Atomic Energy Agency (IAEA) said its current technology could allow key information to be overlooked as it was more than 20 years old.IAEA inspectors make around 3,000 visits a year to more than 900 nuclear facilities worldwide.Such systems are the only method of tracking nuclear material worldwide."Failure to replace the hardware and software, and to integrate fully all the information system components will carry large risks," said an agency statement."A major overhaul of the system is needed to allow inspectors immediate, secure online access to information," said project manager Livio Costantini.The organisation is aiming to start a system upgrade in November, aiming to provide inspectors in the field with secure online access to previous inspection data, design blueprints of nuclear facilities, even satellite images of the plant.The computer systems used to monitor the world's nuclear power installations are so outdated that they are hampering the work of inspectors.An IAEA spokesman said this was extremely inefficient and makes searching for anomalies like searching for a needle in a haystack.	tech
2225	The new book claims Mr Prescott hosted a dinner in November 2003 where the prime minister told Mr Brown he would stand down before the next election because he had lost trust over the Iraq war.In Mr Peston's book Mr Brown is alleged to have told the prime minister: "There is nothing you could ever say to me now that I could ever believe."At a campaign poster launch on Tuesday, Mr Brown was joined by Alan Milburn, who Mr Blair controversially put in charge of election planning in place of the chancellor.Mr Blair then changed his mind in June 2004, after Cabinet allies intervened and amid suspicion the chancellor was manoeuvring against him, writes Mr Peston.On Tuesday, Deputy Prime Minister Mr Prescott told BBC News: "They told us very clearly, it was the troops telling the leaders: get in line."The prime minister and chancellor faced backbench discontent at Monday's meeting of the Parliamentary Labour Party over claims made in journalist Robert Peston's new book.Mr Brown, meanwhile, is visiting Tanzania, Mozambique and Kenya to highlight the plight of many Africans hit by Aids, war and famine - issues which Mr Blair has also spoken out on.	politics
2398	"I think we are going to have the best general election results and local election results we have ever had under [party leader] Charles Kennedy.The Lib Dems are set for their best results in both the general election and the local council polls, one of their frontbenchers has predicted.Local government spokesman Ed Davey was speaking as the party launched its campaign for the local elections being held in 37 English council areas.	politics
1030	The Chicago Film Critics Association (CFCA) named it winner in five categories including best film and best actor for Paul Giamatti.The CFCA awarded Thomas Haden Church the best supporting actor prize and Virginia Madsen the best supporting actress award for their roles in the film.The Southeastern Film Critics also awarded Sideways its best film of the year accolade.Sideways has already been voted best film by critics associations in New York and Los Angeles and has been nominated for a Golden Globe.Director Alexander Payne was named best director, and he also won best screenplay shared with Jim Taylor.	entertainment
1045	Actor Gerard Jugnot - star of the Oscar-nominated film The Chorus - has beaten Gerard Depardieu to become France's best-paid actor of 2004.Jugnot made 5.45m Euros (£3.77m) last year, according to a table drawn up by France's Le Figaro newspaper.On Saturday, it will compete for the title of best film against fellow nominee A Very Long Engagement in France's Cesar film awards.Despite starring in five films in 2004, Depardieu made 3.35m Euros (£2.31m) putting him third place in the chart.Godzilla star Jean Reno was France's second best-paid actor in 2004, earning 3.55m Euros (£2.45m) .	entertainment
244	Despite its string of bad luck, he pointed out, Aurora is just one vessel in a large Carnival fleet, the UK's P&O Princess group having been merged into the much larger US firm in 2003.And with Carnival remaining the market leader, it looks set to keep selling the tickets - no matter what happens to the ill-fated Aurora in the future.Similarly, analysts expect the impact on the rest of the cruise business to be limited.After all, the Aurora incident may be big news in the UK - but for Carnival customers elsewhere it's unlikely to make too much of a splash.And generally speaking, Carnival has a reputation for keeping its ships pretty much on schedule.And its owner, P&O Cruises - now part of the huge US Carnival Corporation - was looking at a significant slice chopped off this year's profits and a potential PR fiasco.In the wake of P&O Princess's takeover by Carnival, the business is now to a great extent a duopoly."The Aurora issue had been an ongoing one for some time," says Deutsche Bank's Simon Champion."Carnival has an incredibly strong track record," Mr Champion.In other words, if you do want a cruise, your options are limited.	business
2388	Elderly and disabled people would choose how their own budget for personal care was spent and organised under government plans.The Tories say people who pay for three years' long-term care directly or through insurance should be guaranteed free care for the rest of their lives.They also want to set up a new "half-way house" where social workers tell people how much money is available for their care and help them choose how to spend that "individual budget".Ministers say elderly and disabled people themselves, not social workers, should be able to decide on their care and stay in their own homes.There are 1.7m people needing care in England and ministers suggest the number could quadruple by 2050.But the government shunned opponents' calls for free long-term care.But Age Concern argued social care was chronically under-funded and older people were being offered choice in principle, but not in practice.And Tony Hunter, president of the Association of Directors of Social Services, said the plans could improve dignity and well-being for thousands of people.The Lib Dems say they would fund free personal care by a new 50% tax rate on incomes over £100,000.He ruled out free personal care in England - which is on offer in Scotland and Wales, saying it was "unsustainable".	politics
3345	Despite not playing for England, Wilkinson is still hoping to make the Lions tour to New Zealand this summer.Lions coach Sir Clive Woodward has not set a deadline for when Wilkinson has to start playing again in order to be considered for selection.But Rob Andrew, coach of Wilkinson's club side Newcastle, said that with only two games left to play Wilkinson was unlikely to be fit in time.That game is the day after England play Italy in the Six Nations and six days before their final match of the championship against Scotland.England's World Cup-winning fly-half said last week he was hoping to recover from his latest injury in time to play some role in the championship.Wilkinson is aiming to make his third start to the season in the Zurich Premiership match against Harlequins on 13 March.	sport
2325	Mr Hockney said the law was clear that those elected on a list who quit their party should keep their seats."The Greater London Act is clear that if someone resigns who was elected on a list, their party whip the seat belongs to them and not the party."He said Mr Hulme-Cross and himself had no intention of resigning and added that they felt that it was UKIP who were not being true to the electorate.The party argues the pair should give up their seats as they won them as UKIP representatives, not as individuals.She said: "The party has taken legal advice and it is clear that we could take legal proceedings against you which could result in the return of our seats and/or damages against you.Veritas was formed by Mr Kilroy-Silk earlier this month after he quit UKIP following an unsuccessful bid to take over as leader.	politics
215	The Act also applies to firms with more than 300 US shareholders, a situation many firms without US listings could find themselves in.It obliges all firms with US stock market listings to make declarations, which, critics say, will add substantially to the cost of preparing their annual accounts.The US stock market watchdog's chairman has said he is willing to soften tough new US corporate governance rules to ease the burden on foreign firms.The SEC has already delayed implementation of this clause for smaller firms - including US ones - with market capitalisations below $700m (£374m).Mr Donaldson said the SEC would "consider whether there should be a new approach to the deregistration process" for foreign firms unwilling to meet US requirements.The US regulator said foreign firms may get extra time to comply with a key clause in the Sarbanes-Oxley Act.But European firms with secondary listings in New York have objected - arguing that the compliance costs outweigh the benefits of a dual listing.European firms have protested that US laws introduced after the Enron scandal make Wall Street listings too costly.Compliance costs are already believed to be making firms wary of US listings.Mr Donaldson said that although the Act does not provide exemptions for foreign firms, the Securities and Exchange Commission (SEC) would "continue to be sensitive to the need to accomodate foreign structures and requirements".	business
1239	Charlie Simpson took his new band Fightstar to the stage on Friday night, just hours after officially announcing his departure from pop band Busted.All three band members stressed that the break up was amicable, although Bourne admitted he was "devastated" to hear of Simpson's departure.When Fightstar eventually took to the stage around 11pm, however, a riotous cheer easily drowned out any hecklers lurking in the crowd.Less impressed were fellow students Ryan Crabbe and Gordon Rennie, who observed, "With Fightstar, Charlie has clearly progressed from Busted's sound, but they're still not very inspiring."He was greeted by a sell-out crowd at the University of Warwick.Warwick student Helen Clutterbuck admitted: "I came to check out Fightstar because of all the controversy.While Simpson declared he would look back with pride on Busted's enormous success, his focus turned immediately to Fightstar, with Friday's press conference coinciding with the start of the band's 13-date tour of the UK.With queues outside the venue long and expectations high, the pressure was on Fightstar to impress.Fuelled by this news, all 1,400 tickets to see Charlie's first post-Busted live appearance - at the University of Warwick's Student Union - sold out rapidly.	entertainment
2271	Mr Howard is expected to say that around £6bn will be available for tax cuts when he makes his announcement on Monday.Tory leader Michael Howard says his party can save £35bn in government spending by tackling waste."Almost every independent expert says if you get another Labour government you are going to have to pay higher taxes," Mr Howard insisted.The money would be ploughed back into frontline services like the NHS and schools with the rest used to cut government borrowing and reduce taxes.Mr Howard said: "All this adds up to a bottom line and the bottom line is at this election people will have a clear choice between Mr Blair, who will waste more and tax more, and a Conservative government that will give them value for money and tax less."The £12bn left over would then be spent on reducing government borrowing, he added.The bulk of the £35bn saved by tackling bureaucracy and inefficient systems will go back into frontline services, Mr Howard said.Mr Howard said that these things happened in politics and it would not affect the outcome of the election.However, Chief Treasury Secretary Paul Boateng said: "None of the Tories' figures add up so they can't make these savings and can't pay for any tax cuts, which means the only guaranteed cut from the Tories is £35bn of cuts, hitting frontline public services hard."Home Office spending could be cut by £1.6bn, according to the final instalment of his year-long review."So part of the £12bn we are going to apply to filling the government's black hole, reducing the borrowing.	politics
4124	Viewers could soon be rewarded for watching TV as loyalty cards come to a screen near you."Parents could pre-pay for some content, as a kind of TV pocket money card," said Nigel Whalley, managing director of media consultancy Decipher.Credit cards that have been chipped could be used in set-top boxes to pay for movies, gambling and gaming.Any household hooked up to Sky could soon be using smartcards in conjunction with their set-top boxes.Sky set-top boxes have two slots.Broadcasters such as Sky and ITV could offer viewers loyalty points in return for watching a particular channel or programme.Loyalty cards could play a role in this, particularly in reducing the number of people who cancel their Sky subscriptions, said Ian Fogg, an analyst with Jupiter Research.Viewers who stay loyal to a particular TV channel could be rewarded by free TV content or freebies from retail partners.	tech
4027	She said the spam e-mails directing people to the site started circulating two days ago shortly after the domain name of the site was registered.She said that DEC hoped to get the fake site shut down as soon as possible.The site is just the latest in a long list of scams that try to cash in on the goodwill generated by the tsunami disaster.Patricia Sanders, spokeswoman for the Disaster Emergency Committee said it was aware of the site and had contacted the Computer Crime Unit at Scotland Yard to help get it shut down.Ms Sanders said DEC had contacted US net registrars who handle domain ownership and the net hosting firm that is keeping the site on the web.DEC was going to push for all cash donated via the site to be handed over to the official organisation.None of the e-mail addresses supplied on the site work and the real owner of the domain is obscured in publicly available net records.All attempts by the BBC News website to contact the people behind the site have failed.BT and DEC's hosting company were also making efforts to get the site shut down, she said.The web address of the fake site is decuk.org which could be close enough to the official www.dec.org.uk address to confuse some people keen to donate.	tech
4377	From 1 January, a new law is being introduced to protect computer users from software known as spyware.One form of spyware called adware has the ability to collect information on a computer user's web-surfing.The state's Consumer Protection Against Spyware Act bans the installation of software that takes control of another computer.The software buries itself in computers and can collect a wide range of information.The makers of computer programs that secretly spy on what people do with their home PCs could face hefty fines in California.Spyware is considered by computer experts to be one of the biggest nuisance and security threats facing PC users in the coming year.Currently users wanting protection from spyware have turned to free programs such as Spybot and Ad-Aware.	tech
1324	Catalina Sandino Moreno has joined a rare group of actresses who have been nominated for an Oscar for starring in a foreign language film.Sandino Moreno is now being regarded as one of the most promising actresses around at the moment.The Colombian-born actress was the final hope for director Joshua Marston, who scoured the US and Colombia for a lead for Maria Full of Grace.And at the 2004 Berlin Film Festival the jury could not choose between her and Charlize Theron's Oscar winning performance in Monster so gave them a tied award.	entertainment
3201	But Mutu has hit out at the club's decision, saying: "Chelsea have destroyed me."Mutu was sacked by Chelsea on Friday after testing positive for cocaine - a move Wenger has backed.Arsenal boss Arsene Wenger would consider signing Adrian Mutu once the striker has served his drugs ban."I didn't expect them to pay me while I was suspended but I never thought they would sack me either.Mutu faces a ban of between six months and two years when the Football Association decides on his punishment.Chelsea decided to act before his case was heard and sacked the striker on grounds of gross misconduct after it was revealed that he had failed a drug test.To make an example of me?It makes it very difficult for me now.""But once he has served his suspension, he has the right again to start from zero.	sport
289	Despite some positive news for the export sector, there are worrying signs for manufacturing, the BCC said.The BCC found confidence increased in the quarter across both the manufacturing and service sectors although overall it failed to reach the levels at the start of 2004.The outlook for the service sector was "uncertain" despite an increase in exports and orders over the quarter, the BCC noted.The UK manufacturing sector will continue to face "serious challenges" over the next two years, the British Chamber of Commerce (BCC) has said.However, the BCC found the whole UK economy still faced "major risks" and warned that growth is set to slow.The reduced threat of interest rate increases had contributed to improved confidence, it said.The rise came despite exchange rates being cited as a major concern.	business
1295	But Kelly said she was "very nervous" about meeting Dame Julie because she was "my absolute hero".Mary Poppins star Dame Julie Andrews watched the hit stage version of her classic film at a charity performance in London's West End.It was the first time Dame Julie, who shot to fame as the nanny in the 1964 Disney movie, had seen the musical, staged at the Prince Edward Theatre.The gala performance saw Dame Julie, 69, return to the theatre where she had her first starring role in a performance of Humpty Dumpty in 1948.	entertainment
227	The submission also calls for decent wages and training for people working in the manufacturing sector.The TUC said in its submission before the Budget that action is needed because of 105,000 jobs lost from the sector over the last year.TUC General Secretary Brendan Barber called for "a commitment to policies that will make a real difference to the lives of working people."The Trades Union Congress (TUC) is calling on the government to stem job losses in manufacturing firms by reviewing the help it gives companies.	business
177	Wimpey said the UK housing market had proved "challenging" last year.But B&B - which has a 22% share of the UK buy-to-let mortgage market - said that while rates of growth were moderating, the sector "continues to grow at a rate considerably above that of the whole mortgage market".B&B said the buy-to-let market - in which the bank is a major player - would continue to grow much faster than the wider mortgage market.Recent housing market surveys have indicated that the UK property market has cooled in recent months after several years of rapid growth.Overall, B&B said that "housing market fundamentals remain strong".The UK property market remains robust despite the recent slowdown, according to mortgage lender Bradford & Bingley and housebuilder George Wimpey.Wimpey reported a 19% rise in profits to £450.7m and said recent new home reservations were better than expected.	business
300	The move by Johnson & Johnson has been widely expected and the firm will pay $76 for each Guidant share, 6% more than Wednesday's closing price.Pharmaceutical giant Johnson & Johnson has agreed to buy medical technology firm Guidant for $25.4bn (£13bn).Analysts said that the deal is aimed at offsetting Johnson & Johnson's reliance on a slowing drug business.A number of Johnson & Johnson's products are facing patent expirations, while the company is also battling fierce competition from generic products.	business
