1064	Eastwood has won best director once before, for Unforgiven in 1993.UK critics still favour The Aviator for best film, but believe the best director title will generate a close fought battle between Eastwood and Martin Scorsese.Scorsese has never won the best director prize, despite four previous nominations for films including Raging Bull, Goodfellas and Gangs of New York."Chris has a sense of humour and everything he says is really said humorously," Cates said.Most experts predict the twice-nominated Jamie Foxx will win best actor for his portrayal of singer Ray Charles, while Vera Drake star Imelda Staunton looks likely to lose out in the best actress field to Hilary Swank in Million Dollar Baby.The 40-year-old comic has already promised not to swear live on air during the show.If the 74-year-old does win, he will become the oldest person ever to be named best director at the ceremony.Details have also emerged of the contents of this year's gift bags, which are given to nominees and presenters on the night.A recent poll of US pundits found Eastwood's boxing drama had become the new favourite to win best film over the Howard Hughes biopic."We are pulling out all the stops," said John Miller, chief of counterterrorism at the Los Angeles Police Department.Actor and comedian Chris Rock will host the event, which will be broadcast with a seven-second time delay to allow censors to cut out any unsuitable content.	entertainment
3445	Serena Williams has angrily rejected claims that she and sister Venus are a declining force in tennis.While Serena is through to the Australian Open semi-finals, Venus went out in the fourth round, meaning she has not gone further than the last eight in her last five Grand Slam appearances.But Serena added: "Venus had a severe strain in her stomach.I don't know many who have done that.""To top it off, we have a very, very, very, very, very close family" Serena continued.But Serena denied their challenge was fading, saying: "That's not fair - I'm tired of not saying anything.Serena also said people tended to forget the impact the 2003 murder of sister Yetunde Price had had on the family."To be in some situation that we've been placed in in the past little over a year, it's not easy to come out and just perform at your best when you realize there are so many things that are so important.	sport
3085	Two-time Olympic 10,000 metres champion Derartu Tulu has confirmed she will take part in the BUPA Great Caledonian Run in Edinburgh on 8 May.Tulu has won the Boston, London and Tokyo Marathons, as well as the world 10,000m title in 2001."We are delighted to have secured the services of one the most decorated competitors the sport has ever seen," said race director Matthew Turnbull.	sport
1153	OutKast did lose out in the contest for best album - which was won by Usher, another award favourite.They won best group, best video and best song for hit Hey Ya!R&B singer Usher won best male and best album for Confessions, while UK rock band Muse were named best alternative act and best British artists.Linkin Park singer Chester Bennington described their prize for best rock band as "quite an honour" while Muse said their win for best alternative act was "a real surprise for us".Spears was named best female, sending a message of thanks on video saying the award "means so much to me".US hip-hop duo OutKast have capped a year of award glory with three prizes at the MTV Europe Music Awards in Rome.Also competing for best group had been the Beastie Boys, the Black Eyed Peas, D12 and Maroon 5.- picked up the prize for best pop act, beating Anastacia, Avril Lavigne, Robbie Williams and Britney Spears.OutKast will add their awards to the four they won at the US MTV Awards in August and three Grammys in February.Eminem's group, D12, were surprise winners in the best hip-hop category, beating the Beastie Boys, Jay-Z, Kanye West and Nelly.And Anastacia, Britney Spears, Maroon 5 and Ludacris had been on the shortlist for best song.Usher, who performed a duet with Alicia Keys, also beat off competition from Justin Timberlake, Jay-Z, Nelly and Robbie Williams to take the best male crown.	entertainment
182	[The unemployment figures] show the main problem of the French economy: we have growth but without an improvement in employment, said Marc Touati, an economist at Natexis Banques Populaires."[Oil prices] will weigh on consumer spending in the short term, and potentially on confidence," he said.At the same time, finance minister Nicolas Sarkozy warned that high oil prices posed a threat to French growth.The French statistics agency, INSEE, expects the economy to grow by about 2.4% this year, buoyed by strong consumer spending and business investment.Analysts said French companies, keen to protect their profit margins at a time of rising energy costs, were reluctant to take on extra staff.	business
1215	Last year, the South Bank Award for best TV drama went to Steven Poliakoff's period piece The Lost Prince, while Bloody Sunday, about the 1972 killings in Northern Ireland, won in 2003.Little Britain was named best comedy while Franz Ferdinand beat Morrissey and The Libertines to the music award.The soap beat fellow ITV1 show Filthy Love and Channel 4's Shameless to win the best TV drama prize on Thursday.Shane Meadows' Dead Man's Shoes picked up the best film award, beating Shaun of the Dead and My Summer of Love.	entertainment
3100	Shalaby earlier said that after an apology Mido would be available for the national side if coach Hassan Shehata chose him.Mido said: "There isn't much I have to say today, all there is to say is that I came specially from England to Egypt to rejoin the national team and to apologise for all my mistakes."Ahmed 'Mido' Hossam has made another apology to the Egyptian people in an attempt to rejoin the national team.Meanwhile, Egypt FA spokesman Methat Shalaby welcomed the apology and said no one had exerted pressure on Mido to apologise.Mido added: "It's not my right to give orders and say when I want to play ... at the same time I will always make sure that I put the national's team's matches as my top priority."Mido's apology today does not negatively affect Mido in anyway, on the contrary it makes him a bigger star and a role model for all football players," Shalaby said.	sport
4086	Writing a Microsoft Word document can be a dangerous business, according to document security firm Workshare.Up to 75% of all business documents contained sensitive information most firms would not want exposed, a survey by the firm revealed.Workshare surveyed firms around the world and found that, on average, 31% of documents contained legally sensitive information but in many firms up to three-quarters fell in to the high risk category.Sensitive information inadvertently leaked in documents includes confidential contractual terms, competitive information that rivals would be keen to see and special deals for key customers, said Andrew Pearson, European boss of Workshare which commissioned the research.Microsoft recommends that the tool is used before people publish any Word document.As documents get passed around, worked on and amended by different staff members the sensitive information finds its way into documents.Few firms have any knowledge of the existence of this so-called metadata about the changes that a document has gone through or that it can be reconstructed.The problem is particularly acute with documents prepared using Microsoft Word because of the way it maintains hidden records about editing changes.	tech
1067	A film that follows a group of alienated youth in a Paris suburb as they prepare to perform an 18th Century play has won France's top cinema award.US film Lost in Translation won the award for best foreign feature.The Chorus, a film about a schoolteacher who introduces an unruly classroom to the pleasures of classical singing, won two awards - for best music and best sound.Kechiche said he made the film because he "wanted to show people we don't normally see at the cinema".A Very Long Engagement, a World War I drama featuring Audrey Tautou, won five Cesar awards.	entertainment
2147	Home Secretary Charles Clarke has been quoted as telling Labour members he wants more migrants to come to the UK.The latest pre-election spats come after Mr Blair told Labour members the Tories offered a "hard right agenda" which would take Britain backwards.But Mr Clarke accused him of trying to score "cheap political points" by muddling immigration with asylum.Mr Blair's was asked last Wednesday if the government's new immigration plans, including a point system for economic migrants, would reduce net migration.Mr Clarke said he had made clear the UK would welcome genuine economic migrants for key jobs on a strict points based system.Earlier, Dr Fox accused Mr Blair and other Cabinet ministers of telling lies about Tory policies and then attacking the lies.London's Evening Standard quoted Mr Clarke telling Labour activists at a question and answer session in Gateshead that he wanted Britain to offer refuge for those fleeing tyranny.Mr Clarke dismissed the latest Tory attack.Labour has already broken its pre-election promise on immigration before the ink has dried on its new pledge card, the Tories have claimed.On Monday, Dr Fox told reporters: "The prime minister has broken his word so many times in the past but now his promises do not even last a week.	politics
409	UK-based bank Standard Chartered said it would spend $3.3bn (£1.8bn) to buy one of South Korea's main retail banks.The move, a year after Citigroup beat Standard Chartered to buy Koram bank, would be the South Korean financial sector's biggest foreign takeover.Standard Chartered said KFB was a "well-managed, conservatively run bank with a highly skilled workforce" and represented a "significant acquisition in a growth market".Some analysts also queried whether Standard Chartered had overpaid for KFB.Standard Chartered said acquiring Korea First Bank (KFB) fulfilled a strategic objective of building a bigger presence in Asia's third largest economy.Standard Chartered expects about 16% of future group revenue to come from KFB.This time around, Standard Chartered is thought to have beaten HSBC to the deal.KFB is South Korea's seventh largest bank, with 3 million retail customers, 6% of the country's banking market and an extensive branch network.Standard Chartered said it was buying 100% of KFB, an agreement that would bring an end to the bank's complex dual ownership.HSBC will now have to wait for the next South Korean bank in line to be sold off - thought likely to be Korea Exchange Bank, also currently in the hands of a US group.Standard Chartered sees "the opportunity to create value by the introduction of more sophisticated banking products".The deal, which requires regulatory approval, is expected to be completed by April 2005 and to be earnings accretive in 2006, Standard Chartered said.Standard Chartered has its headquarters in London but does two thirds of its business in Asia, and much of the rest in Africa.	business
3388	England captain Jonny Wilkinson will make his long-awaited return from injury against Edinburgh on Saturday.Wilkinson, who has not played since injuring his bicep on 17 October, took part in full-contact training with Newcastle Falcons on Wednesday.Wilkinson's year has been disrupted by injury as his muscle problem followed eight months on the sidelines with a shoulder injury sustained in the World Cup final.The 25-year-old missed England's autumn internationals after aggravating the haematoma in his upper right arm against Saracens.	sport
4381	The base station processes the information from the satellite transmission and turns it into a form that can be read by the handheld E-slates."The E-slates connect via a wireless connection to a base station in the school.It is a pilot project run by EduVision, which is looking at ways to use low cost computer systems to get up-to-date information to students who are currently stuck with ancient textbooks."We plan to put a solar panel at the school with the base station, have the E-slates charge during the day when the children are in school, then they can take them home at night and continue working."Then every rural school in Africa would have access to the same libraries as the students in Oxford and Harvard" Currently the project is operating in an area where there is mains electricity.Matthew Herren from EduVision told the BBC programme Go Digital how the non-governmental organisation uses a combination of satellite radio and handheld computers called E-slates.But Mr Herren says there are both pros and cons to the project."It's very simple to set up, just a satellite antenna on the roof of the school, but it's also a one-way connection, so getting feedback or specific requests from end users is difficult."But Mr Herren says EduVision already has plans to extend it to more remote regions.At the Mbita Point primary school in western Kenya students click away at a handheld computer with a stylus.EduVision is planning to include audio and video files as the system develops and add more content.	tech
1205	The British producers of US Wife Swap are taking legal action against a show they claim is "a blatant and wholescale copycat" of their programme.ABC bought the rights to the British show, which was first aired in 2003 and became a hit on Channel 4.Earlier this year, the NBC network claimed that Fox's boxing show The Next Great Champ had been hurriedly produced to ensure its programme was the first to be screened.RDF Media, which makes the show for US network ABC, has filed a damages claim for $18 million (£9.25 million) against Fox's Trading Spouses.Their show was first screened in June, and was criticised in the press for its similarities to Wife Swap.	entertainment
2257	Labour's Paul Flynn said Mr Blair and Mr Brown had a "scorching" from MPs adding: "It was a Parliamentary Labour Party meeting like no other."Relations between Mr Brown and Mr Milburn are widely reported to be cool ever since Mr Blair brought the latter back into the Cabinet to run Labour's election campaign, a role successfully carried out by Mr Brown in both 1997 and 2001.The new book claims Mr Prescott hosted a dinner in November 2003 where the prime minister told Mr Brown he would stand down before the next election because he had lost trust over the Iraq war.Backbencher Stephen Pound said some MPs had threatend to expose those fuelling the reports if Mr Blair and Mr Brown did not "stop this nonsense, this poisonous briefing".Mr Blair has insisted he has done no deals over the premiership while Mr Brown says he will not let "gossip" distract him from helping a unified election campaign.But he argued Mr Blair and Mr Brown could work successfully together and had produced a strong economy and better public services.New speculation about the state of their relationship was sparked by claims in Brown's Britain, by Sunday Telegraph journalist Robert Peston, which suggested Mr Blair went back on a pledge to make way for Mr Brown.Mr Prescott said there was a dinner but the discussions were confidential.Mr Prescott said there were occasional disagreements in any government.	politics
3309	It was not like the days gone by when you could get scores on the board early.Every one was a little down after the game following the injuries to Brian and Gordon.It was great work by Brian and I always knew I had scored even though it went upstairs to the video referee.The different interpretations between the referee and the players was a little difficult.It was really hard work out there and the players have plenty of bumps and bruises to prove it.It was very physical and fair play to the Italians they made us work very hard for our victory.Their organisation was very, very good and they proved again that they are getting better and better as the years go by.That new ruck law made it a bit more difficult to get out of our own half.I was very impressed the way the Scots played against the French on Saturday.Eddie (O'Sullivan) was very calm at half-time even though we were only 8-6 ahead.So really we went back to playing a territory game and simplifying things and having more patience on the ball.	sport
4139	Xbox video game Halo 2 has been released in the US on 9 November, with a UK release two days later.There was nothing in Halo that had not been done before but everything in there was as good as it could be."The game instantly cultivated an online following, which continues today with a score of Halo fan websites following every aspect of the sequel, Halo 2.When the Xbox launched on November 15 2001 in the US, Halo was one of the launch titles and had an immediate impact on critics and consumers.The game also inspired thousands of people to write their own fiction based on the storyline and produce downloadable video clips of the many weird and wonderful things that can be done in the game.Halo is considered by many video game pundits to be one of the finest examples of interactive entertainment ever produced and more than 1.5 million people worldwide have pre-ordered the sequel.Why is the game among the most anticipated of all time?"It blew me away the first time someone managed to climb to the top of Halo," said Errera, referring to a fan who had created a video of Master Chief scaling the landscape of the graphical world.It also capitalised on the growing popularity of LAN gaming in the PC world - for the first time it became easy to link multiple game consoles together, allowing up to 16 players to battle against each other at the same time.Halo was unusually immersive, sucking the player into the action and blurring the interface between screen and controller."The first time I played it I just stood there watching the spent shells fall out of my gun," said Errera, remarking on the level of detail in the game."Halo is the most important launch game for any console ever," wrote the influential Edge magazine in its review, giving it a rare 10 out of 10 mark.Halo 2 is out on 9 November in the US and 11 November in the UK	tech
2360	Mr Brown will undoubtedly claim the forecasts are simply wrong and that he will have absolutely no need to raise taxes after the election, should Labour win.That is the size of the financial "black hole" the Tories, backed by some independent forecasters, believe Mr Brown will have to fill with tax increases after the election.The opposition will reject that by claiming they can keep the economy sound, increase spending and cut taxes at the same time.The Liberal Democrats will also promise to run a sound economy, but based on increased taxes to fund spending and, amongst other things, abolishing the council tax in favour of a local income tax.The opening shot in that battle was fired at the weekend with claims a Treasury leak suggested Mr Brown was ready to slap capital gains tax on home sales to raise some of that cash.And, needless to say, there will be plenty of analysis of what impact the Budget will have on Mr Brown's own ambitions to replace Mr Blair as prime minister at some point after a third win.But Mr Brown will stun Westminster and break just about every historical precedent if he fails to do something designed to put a smile on voters' faces and make them more inclined to back Labour in the election.But probably what that all boils down to is a simple question of which of the parties the voters most trust to keep the economy stable and avoid any unpleasant surprises in the coming years.	politics
4107	The Wolong Nature Reserve in the Sichuan Province of southwest China is home to 20% of the remaining 1,500 giant pandas in the world.It includes a 802.11b wireless network and a video monitoring system using five cameras to observe pandas around the clock.The world's dwindling panda population is getting a helping hand from a wireless internet network.A broadband and wireless network installed on the reserve has allowed staff to chronicle the pandas' daily activities."Digital technology has transformed the way we communicate and share information inside Wolong and with the rest of the world," said Zhang Hemin, director of the Wolong Nature Reserve.The network has been developed by Intel, working closely with the staff at Wolong.	tech
1061	Indian film director Mira Nair has said she was thrilled to be given the chance to make William Makepeace Thackeray's novel Vanity Fair - as the book has been a favourite through her life.But Nair said that her film had picked up on the way Thackeray - who was born in India but moved to England as a young man - had seen the world."First, when I was 16, it was Becky Sharp, who is a completely memorable character, because I recognised myself in her - I recognised all the ladies who did not want to be ladies, who wanted to buck the system that they were in," she said."It was serendipity really - I was offered Vanity Fair by the studio Focus Features, who had distributed Monsoon Wedding," Nair told BBC World Service's Masterpiece programme.Nair also defended her decision to cast an American actress - Reese Witherspoon - as Becky Sharp, despite the fact that all the rest of the cast are British or Irish.But Nair said that, though this had created the need for some filming tricks, it had in fact also helped the film.The film has a new ending, with Becky Sharp running off for a new life in India.Nair said that she jumped at the chance to work on the film, which she has - controversially - made in a Bollywood style, including two song-and-dance routines in the film's second half."As I got older and read it, I think it was Thackeray's clarity - his clear-sightedness about his own society, the fact that he was born in India but came to England as a young man - that gave him the eyes of an outsider, and yet he was an insider."It was a self-fulfilling prophesy - when I first met her husband [actor Ryan Philippe], I said 'knock her up, won't you, I need some flesh on the girl'," she joked.This was, for me, about Becky Sharp being, eventually, a full-blown woman through the course of the film.The book is one of the classics of English literature - the story of scheming 19th Century social climber Becky Sharp, played in the film by Reese Witherspoon."They offered me their next-best thing, not realising that Vanity Fair had actually been one of my favourite novels since I was 16 years old in an Irish Catholic boarding school in India.""I cast intuitively - in my films I cast as many non-actors as I cast actors," she said.	entertainment
2303	Within hours of his final talks with Mr Thorpe, Sir Edward told the nation he was resigning and the Queen invited Mr Wilson to form a new minority government."The PM said he was bound to tell Mr Thorpe that his colleagues had told him that they would not agree to serve under any other prime minister.Mr Thorpe told Sir Edward: "I am sorry this is obviously hell - a nightmare on stilts for you.Documents show that Sir Edward mulled over resigning and perhaps returning to coalition government in a Labour-led coalition.But Sir Edward said that was impossible because the Labour left was set against it and the pair settled on trying for a Conservative-Liberal pact."Jeremy said he was encountering a rather embarrassing problem with his colleagues about the prime minister personally," reads a telephone memo for Mr Heath.Hours later Sir Edward's hopes of a deal unravelled as Mr Thorpe's colleagues refused to support him.But he already knew Mr Wilson would not form a coalition with either the Liberals or the Conservatives because of the opposition of the Labour left.According to the documents released at the National Archives, the "friendly and easy" first meeting indicated that both Sir Edward and Mr Thorpe thought they had the makings of a deal.Mr Thorpe was in high spirits, having just led his party to a historic jump in support.Mr Thorpe was at liberty to verify this by talking to one or two of the prime minister's colleagues."	politics
