4374	In the chronology of home computing, Commodore was one of the pioneers.The Commodore 64, launched in 1982, was one of the first affordable home PCs.Commodore International filed for bankruptcy in 1994 and was sold to Dutch firm Tulip Computers.The once-famous Commodore computer brand could be resurrected after being bought by a US-based digital music distributor.The Commodore 64 sold more than any other single computer system, even to this day.In the late 1980s the firm was a great rival to Atari, which produced its own range of home computers and is now a brand of video games, formerly known as Infogrames.	tech
3502	Dechy said.The Belgian sports minister at the centre of the Svetlana Kuznetsova doping row says he will not apologise for making allegations against her.Eerdekens said he made the statement in order to protect the other three players that took part in the tournament, Belgian Justine Henin-Hardenne, Nathalie Dechy of France and Russia's Elena Dementieva.Dementieva is also angry and says that Dechy and herself are the real victims of the scandal."The WTA are trying to handle this problem by saying there are three victims, but I see only two victims in this story - me and Nathalie Dechy, who really have nothing to do with this.It's been too hard on me," she said.But Dechy is fuming that she has been implicated in the row.Criticised for making the announcement, he said: "I will never apologise.The Russian said she did nothing wrong by taking the medicine during the event.	sport
119	Slower consumer spending and a quieter housing market are likely to have convinced the MPC that rates should be left unchanged in recent months.Howard Archer, economist at Global Insight said the MPC "may well consider that the balance of risks to the growth and inflation outlook have moved from the downside to the upside".Economists see next week's inflation report from the MPC as key in assessing whether a further interest rate rise is necessary to keep the economy in check.Interest rates rose five times between November 2003 and August 2004 as soaring house prices and buoyant consumer data sparked inflation fears.Philip Shaw, chief economist at Investec Securities, said he believed rates would remain at 4.75% for the rest of the year although strong economic data could lead to a further hike.The British Chambers of Commerce (BCC) said it was "concerned by the clamour in some quarters" for early interest rate increases.The Bank of England has left interest rates on hold at 4.75% for a sixth month in a row.Data on Wednesday also showed manufacturing output rose at its fastest rate since May last month, reinforcing a view that economic growth was stronger than forecasts."Growth appears stronger and the MPC may become more concerned about inflation trends."	business
2019	But the Scottish Executive has insisted Mr McConnell was speaking about adults and his comments were "a recognition that people will get drunk".Mr MacDonell said: "I think the problem here is that he did say a lot more things about binge drinking and under age drinking.Mr MacDonell, political editor of The Scotsman, said: "I think we have to say right at the outset that this was a very stupid and ill-advised remark by the first minister.Mr MacDonell said that the first minister should know by now that if he said things which were "off the mark", they were bound to "come back and bite him".He added: "Here, Mr McConnell was talking in the Highlands to 100 teenagers and every word he said was put out on a webcast by the Scottish Executive and then looked at by other politicians and reporters.He said it was vital that young people were properly informed about the risks incurred to themselves and others when they got drunk.The media attention had helped to move the focus from Scotland's binge drinking problems, Mr Law said.The one-sentence comment was immediately criticised by the Scottish National Party which accused him of encouraging young people to get drunk.Mr McConnell was speaking on Monday to more than 100 secondary pupils from schools in the Highlands about the problems of binge drinking and drink promotions.He said he accepted that young people drank and they did have problems with drink.Mr Law added: "I think the remark was ill-advised - but these remarks are blown out of all proportion and they so easily misrepresent what we are trying to do in Scotland.	politics
3347	Brian Moore believes the England captain should not be a full-back.And Moore believes the last two games against Italy and Scotland are a good opportunity to experiment further.And former England captain Moore told the BBC: "Full-backs are too far away from the action."The problem is the players that are around to replace the icons which have been lost because of retirement and injury don't have the requisite experience," Moore added.Their creativity depends on quick ball and we're not getting that.""Wer'e not getting quick ball, which means the backs are being stifled.Moore says a lack of cohesion in the forwards is one of the reasons why England have lost against Wales, France and Ireland in this year's tournament.	sport
3408	Now the Italians travel to Edinburgh hoping to claim their first away win in the Six Nations.Italy have only recorded three wins since they joined the Six Nations in 2000, but two of those have come against Scotland.Italy skipper Marco Bortolami believes Saturday's Six Nations contest against Scotland will be a scrappy encounter."It will not be a pretty game because both teams are desperate to gain their first win," said the lock forward.With both sides looking for their first win of the championship, the third-round game at Murrayfield has been billed as a wooden-spoon decider.	sport
2183	Former Northern Ireland minister Sir Nicholas Scott has died at a London hospice, his family has announced.As a Northern Ireland minister he dealt with education and later security where he rode out the mass IRA escape from the Maze in 1983.After leaving Northern Ireland in a reshuffle, he became a UK disability minister.Sir Nicholas was replaced as the member for Kensington and Chelsea by the flamboyant Alan Clark, after being deselected by his constituency in December 1996.Sir Nicholas claimed strong painkillers he was taking for a back problem had reacted badly with a small amount of alcohol.Sir Nicholas was a strong defender of the Anglo-Irish Agreement and was held in esteem in Dublin government and SDLP circles.Victoria, a lobbyist for disabled rights, denounced her father's actions and heaped insult on injury when she joined the calls for him to resign.	politics
179	Irish billionaires Mr McManus and Mr Magnier are said to believe that an £800m bid undervalues club prospects.Mr Magnier and Mr McManus, who hold their stake through their Cubic Expression investment vehicle have the power to block a bid.Mr Magnier and Mr McManus issued a statement late on Friday saying that they remained "long-term investors" in Man Utd.Mr Glazer has been stalking the premier league football club since 2003.	business
4284	Security firm iDefence, which notified users of the problem, recommended that users upgrade to iTunes version 4.7.1.The problem affects all users of iTunes - Windows and Mac OS - running versions 4.7 and earlier.A new version of iTunes is now available from the Apple website which solves the problem.Users of Apple's music jukebox iTunes need to update the software to avoid a potential security threat.	tech
3474	But I was fighting."Sharapova, who lost 6-2 6-2 to Kuznetsova in Beijing in September, said: "In Beijing, she was coming off such a big winning streak [14 matches] and she was unstoppable."It was lots of pressure.France's Mauresmo routed Vera Zvonareva 6-1 6-0, while Wimbledon champion Sharapova was a 6-1 6-4 winner over fellow Russian Svetlana Kuznetsova."She got mad a little bit and I played some great tennis," said Mauresmo, who was runner-up to Kim Clijsters in last year's final.I want to get the ranking back, but it's very different than before I was number one."It was an obsession, but now I take it in a relaxed way."Mauresmo's win was her ninth in a row as she tries to overtake Lindsay Davenport for the number one spot."This time, it was important to start off well and put some pressure on her.""It's hard to go out there and get it right but I'm fighting and I'm hoping," said Williams.The tournament debutant added: "I love it here.	sport
401	According to a statement from Mr Spitzer's office, the Marsh executive admitted he instructed insurance companies to submit non-competitive bids for insurance business between 2002 and 2004.Through the practice, Marsh was allowed to determine which insurers won business from clients, and so control the insurance market, Mr Spitzer's office added.It also protected incumbent insurers when their business was up for renewal and helped Marsh to maximise its fees, a statement said.Mr Spitzer's office added Mr Stearns had also agreed to testify in future cases during the industry inquiry."We are saddened by the development," Marsh said in a statement.An executive at US insurance firm Marsh & McLennan has pleaded guilty to criminal charges in connection with an ongoing fraud and bid-rigging probe.	business
1304	Wolf Brother is an enchanting book, he said.Paver is currently writing the second book in the series.It was published in 2004, with Paver earning an advance of $5m (£2.8m) - the highest sum ever paid for a debut children's book."Michelle Paver lives and breathes the worlds she writes about," said a spokesman for the author.Wolf Brother tells the story of Torak, a 12-year-old hunter who lives in the forest."I've told her about the film deal but at the moment she is writing the second book and her mind is 6000 years away deep in the primeval forest."	entertainment
92	Conservatives in parliament say Turkcell's stake in Irancell, the new network, should be cut from 70% to 49%.Turkcell signed a contract for the new network in September.Iran currently has only one heavily congested mobile network, with long waiting lists for new subscribers.They say that Turkcell is a security risk because of alleged business ties with Israel.Turkcell said the ruling would "make more difficult... Turkcell's financial consolidation of Irancell" because its stake would be reduced to less than 50%.The firm has refused to comment on whether it has business dealings in Israel, although like almost all GSM operators worldwide it has an interconnection deal with Israeli networks so that its customers can use their phones there.Turkcell now says it may give up on the deal altogether.Telecoms is one of two areas specifically targeted by the new veto law on foreign investments, passed earlier in September.	business
181	Russian media reported that India and Russia signed a memorandum of understanding on energy co-operation on Tuesday during a meeting between Oil and Natural Gas Corporation chairman Subir Raha, Gazprom chairman Aleksey Miller and India's petroleum minister Mani Shankar Aiyar.India and Russia are to work together in a series of energy deals, part of a pact which could see India invest up to $20bn in oil and gas projects.On the agenda are oil and gas extraction as well as transportation deals, to be led by Russian energy giant Gazprom and India's ONGC.Russian news agencies reported that India's petroleum minister Mr Aiyar and Russian energy minister Viktor Khristenko would discuss the future of Yugansk at a meeting on Tuesday.ONGC could invest in gas and oil fields in Sakhalin, in the far east of Russia, and may also take part in joint tender bids for projects in eastern Siberia and the Caspian Sea.The agreement is likely to see the two companies develop refining facilities in Russia, India and elsewhere and organise delivery of oil, gas and petrochemicals from Russia to India and other countries across Asia.India is urgently searching for fresh energy supplies - particularly liquefied natural gas - as domestic demand is growing at more than 5% a year."What we are saying is - Gazprom has a huge amount of gas and we have the money.The former Yukos subsidiary was controversially sold off last year and eventually acquired by state-owned energy giant Rosneft.	business
2384	British citizens are being included in the changes after the law lords said the current powers were discriminatory because they could only be used on foreign suspects.He said intercept evidence was only a small part of the case against the men and some of it could not be used because it could put sources' lives at risk.Under the proposed changes - prompted by the House of Lords ruling - the home secretary could order British citizens or foreign suspects who could not be deported, to face house arrest or other measures such as restrictions on their movements or limits on their use of telephones and the internet.He said the standard of proof for the new powers would have to be "very high indeed" and he asked whether ministers had looked at measures which fitted with human rights laws.The Law Society dubbed Mr Clarke's new proposals an "abuse of power".It comes after law lords ruled that the detention of 12 foreign terror suspects without trial breached human rights.UK citizens suspected of involvement in terrorism could face house arrest as part of a series of new measures outlined by the home secretary.There have been calls for the rules for wire-tap and intercept evidence to be allowed to be used in courts but Mr Clarke refused to back that change.Mr Clarke said prosecutions were the government's first preference and promised the powers would only be used in "serious" cases, with independent scrutiny from judges.He suggested changing the law to let security-cleared judges view evidence gathered by phone-tapping could allow more terror cases to come to court.Mr Clarke also said intelligence reports showed some British nationals were now playing a more significant role in terror threats.	politics
3204	Uefa says it will allow European matches to be played on artificial pitches from the start of next season.Uefa spokesman Rob Faulkner said: "People in England have bad memories of the artificial pitches of Luton and QPR in the 1980s, but the latest generation are completely different and are much more like grass.Several leading clubs from Scandinavia, Russia and eastern Europe - especially those who only play Champions League or Uefa Cup matches in winter - are now expected to instal artificial pitches.Luton, Preston, Queens Park Rangers and other clubs used to have plastic pitches during the the 1980s but, after a two-year study, Uefa insists the surfaces have moved on.	sport
4115	The technology would allow digital people and other computer-generated elements to be combined with the actual view seen by tourists as they walk around an historical site.The camera captures the view and feeds it to software on the computer where the visitor's viewpoint is combined with animated virtual elements.Andrew Stoddart, chief scientist at 2d3, said that the EU project has been driven by a new desire to bring the past to life.It would allow visitors a glimpse of life as it was originally lived in places such as Pompeii.Unlike virtual reality, which delivers an entirely computer-generated scene to the viewer, the Lifeplus project is about combining digital and real views.The old-fashioned audio tour of historical places could soon be replaced with computer-generated images that bring the site to life.At Pompeii for example, the visitor would not just see the frescos, taverns and villas that have been excavated, but also people going about their daily life.Crucial to the technique is the software that interprets the visitor's view and provides an accurate match between the real and virtual elements.	tech
2292	UKIP officials claim it was in fact Mr Kilroy-Silk, not Mr Farage, who briefed newspapers he was leaving the group of MEPs.Mr Kilroy-Silk separately said he had argued against UKIP working with such groups which believed homosexuality was a sin.The film also included footage of a row between Mr Kilroy-Silk, MEP Nigel Farage and party leader Roger Knapman about rumours that he was about to resign the UKIP whip in the European Parliament."I was trying to be helpful to the party and it was the wrong thing to do, I should have told the truth."Later in unguarded, off-air comments in a television studio, Mr Kilroy-Silk was heard saying he was irritated by "defending some of these right-wing fascist nutters".Mr Kilroy-Silk told them he had not left the UKIP group - a move he announced shortly after the meeting.A UK Independence Party MEP suggested Germany saw the EU as an 'empire' and was cheaper than using tanks, a new documentary has revealed.Asked by the documentary makers why he had lied about his leadership ambitions, Mr Kilroy-Silk said: "There was one thing I said that I shouldn't have said at the time.The meeting was shown in a BBC 3 film on ex-UKIP MEP Robert Kilroy-Silk.He argued that peace was the only reason for having the "outdated" EU as there was no economic justification.He says he was not "German-bashing" but saying peace was the EU's founding aim.The documentary showed some of the tensions between Mr Kilroy-Silk and his fellow MEPs after UKIP took third place in last year's European elections.He did not defend other groups' religious beliefs but argued it was their right to hold such views - just as Mr Kilroy-Silk had a right to criticise Arab states.A UKIP spokesman said there were more than 40 MEPs in the same group in the European Parliament.	politics
2357	But he said local governments had to deliver good services without big council tax rises.Mr Raynsford said nearly all central government departments had an interest in well run local authorities.Ministers are unhappy about plans to use Whitehall cash to keep council tax bills down, local government minister Nick Raynsford has acknowledged.Mr Raynsford also plans to make savings of £100m by making changes to local government pensions schemes.Ministers had to be sure local government could deliver without "unreasonable council tax increases", he added.The central government cash is part of a £1bn package to help local authorities in England keep next year's council tax rises below 5%, in what is likely to be a general election year.But he said there was a recognition that "a good settlement for local government" was important to health, education and "other government departments".	politics
1178	Entrepreneur Sir Richard Branson's US TV show, The Rebel Billionaire, is proving a flop in the ratings.But Fox has said it plans to stick with Branson's show throughout its 12-episode run.The Rebel Billionaire has marketed itself as a less materialistic version of The Apprentice, with Sir Richard shown jumping out of a taxi, while Trump is seen in a limousine.Contestants on Sir Richard's show are confronted with business tasks to solve, similar to The Apprentice.The Rebel Billionaire has averaged five million viewers and is 91st in the rankings of all prime-time shows.	entertainment
160	Instead, GM swapped a 6% stake in itself for 20% of Fiat - and gave Fiat a "put option" to sell GM the rest of the car maker between January 2004 and July 2009.Fiat had sold GM a stake in 2000, as part of a partnership agreement."We needed scale in Europe to get costs down, and we were able to do that in working with Fiat," said GM chief executive Rick Wagoner.General Motors of the US is to pay Fiat 1.55bn euros ($2bn; £1.1bn) to get out of a deal which could have forced it to buy the Italian car maker outright.Analysts said Fiat seemed to have done well out of the deal, although some predictions had expected a 2bn euro pay-off.Fiat is to get 1bn euros immediately, with another 550m to follow within 90 days.But despite the alliance Fiat failed to put itself back on track, continuing to lose money and market share.	business
309	Shares in Anglo-Swedish drug have closed down 8% in UK trade after the failure of its Iressa drug in a major clinical trial.John Patterson will be in charge of drug development.AstraZeneca had hoped to pitch its Iressa drug against rival medicine Tarceva.The lung cancer drug did not significantly prolong survival in patients with the disease."This would be two of the three blockbuster drugs that were meant to power the company forward failing... and we've got risks on Crestor," said Nick Turner, analyst at brokers Jefferies.	business
3284	We controlled the game in the first half but we knew that they would come out and try everything after half-time, he said.Hodgson failed to convert three penalties and also missed a relatively easy drop goal attempt which would have given England a late win."They won the game from kicking penalties from our 10m line.England went in at half-time with a 17-6 lead but they failed to score in the second half and Dimitri Yachvili slotted over four penalties as France overhauled the deficit.Andy Robinson said he would "keep working on the kicking" with his squad.However, the England coach added that he would take some positives from the defeat."I'm very disappointed with the result and with my myself," Hodgson said.he said.Fly-half Charlie Hodgson admitted his wayward kicking played a big part in England's 18-17 defeat to France."We went out to play and played some very good rugby and what have France done?"The lads showed a lot of ambition in the first half, they went out to sustain it in the second but couldn't build on it.	sport
4120	Twenty-eight people, including a Briton, have been arrested after a global operation against a website allegedly involved in identity fraud.Those arrested are accused of operating Shadowcrew.com, which investigators claim was a global clearing house for criminals involved in credit card fraud.She said criminals were using the websites to traffic counterfeit credit cards and false identification information and documents such as credit cards, driver's licences, passports and birth certificates.All 28 people detained globally are suspected of being involved in an internet-based network which stole people's identities and used computers and websites to defraud credit card companies.The websites shared tips on how to commit fraud and provided a forum by which people could buy the information and tools they needed to commit such crime, she said.A 19-year-old man from Camberley, Surrey, was arrested by the National Hi-Tech Crime Unit but has been bailed.Assistant US Attorney Scott Christie said several people had been arrested in Argentina, Bulgaria, Canada, Estonia, Poland and Sweden.The Shadowcrew site, which has now been taken over by the US Secret Service, listed several discussion groups, in English and Russian, including one on hacking, spam and online anonymity tools.The US Secret Service was first tipped off in July 2003.	tech
1273	Viotti, director of La Fenice since 2002, conducted at renowned opera houses worldwide including Milan's La Scala and the Vienna State Opera.The last opera he directed at La Fenice was Massenet's Le Roi de Lahore.At La Fenice Viotti was widely acclaimed for his production of the French composer Massenet's Thais and some of his other productions included Giuseppe Verdi's La Traviata and Richard Strauss's Ariadne auf Naxos.Conductor Marcello Viotti, director of Venice's famous La Fenice Theatre, has died in Germany at 50.Viotti's debut at the New York's Metropolitan Opera came in 2000 with Giacomo Puccini's Madame Butterfly, followed by La Boheme, La Traviata and Fromental Halevy's La Juive.His time at La Fenice coincided with its reopening in 2003 after it was destroyed by fire in 1996.	entertainment
